{
  "schema_version": "v9.2.0",
  "adapter_id": "polygon-mainnet",
  "chain_family": "evm",
  "chain_name": "polygon",
  "network": "mainnet",
  "chain_id": 137,
  "rpc_endpoint_kind": "alchemy",
  "contract_address": "0xb2c3d4e5f6a7b8c9d0e1f2a3b4c5d6e7f8a9b0c1",
  "contract_version": "v1.1.0",
  "submission_gas_limit": 150000,
  "confirmation_blocks": 5,
  "timeout_ms": 45000,
  "fingerprint": "sha256:15ad77ab68e940fa8696674377727a05ca83750513036829b779e35b30bf1571"
}
